id,company,post_title,post_date,post_text,Tipo,Assunto,Modelo,post_likes,post_comments,post_video_views,post_hashtags,origin
35,gft-group,,2021-01-18,"As empresas dos mais diversos segmentos precisam ter dados assertivos para orientar tomadas de decisões estratégicas. Uma dessas formas é por meio de cruzamento entre múltiplas fontes de dados. Hoje, áreas como o #marketing se baseiam no #BigData e em outros processos como o #Scraping e o #Crawling para a coleta de análise de informações de produtos, serviços, leads e consumidores.Este é o tema da nossa #terçatech de hoje!Quem assina o texto é a Juliana Szabadi, desenvolvedora de Software da GFT Brasil.Acesse: https://bit.ly/2LL2Wm4#terçatech #tuesdaytech #BigData'",,,,28,0,0,"#marketing, #BigData, #Scraping, #Crawling, #terçatech, #terçatech, #tuesdaytech, #BigData'",linkedin
36,gft-group,,2021-01-18,"En GFT México queremos invitarte a nuestra primera sesión de este 2021 de Tequila Tech Talks; sesiones en línea donde hablamos de tecnologías en banca, seguros e industria, en un nivel muy profesional pero completamente relajado ¡y compartiendo un trago en línea!.En nuestra sesión del próximo miércoles 20 de enero de 18:00 a 19:30 hrs., (CDMX) hablaremos de Trendings en Tecnologías para 2021, bajo la experiencia de Jade C. de GFT México. Para obtener tu acceso envíanos un mail a: marketing.mexico@gft.com#gftworldwide #gftmexico'",,,,38,1,0,"#gftworldwide, #gftmexico'",linkedin
37,gft-group,,2021-01-18,"#GFTnamídia: Estamos na ISTOÉ Dinheiro!A história de Rodrigo Nascimento, estagiário da GFT Brasil que conheceu a companhia por meio da ONG Meu Futuro Digital, foi destaque na reportagem “Um plano Digital para o Brasil”, escrita pelo jornalista Beto Silva  Antes de entrar para o nosso #teamGFT, Rodrigo revezava entre os estudos, auxiliar a mãe com os irmãos e uma rotina de 12 horas de trabalho em um supermercado no Bairro Congonhal, na zona rural da cidade de Tatuí, a 130 quilômetros de São Paulo (SP). Mas ele nunca desistiu dos seus sonhos.  Na entrevista para uma das principais revistas de negócios do país, Marco Santos, presidente da GFT para Estados Unidos e América Latina e idealizador da ONG Meu Futuro Digital, fala da importância de investimentos na educação de jovens como Rodrigo e também do crescimento exponencial da GFT.  Leia na íntegra a reportagem: https://lnkd.in/ds-Un-f #GFTnaMídia#TecnologiadaInformação#Educação'",,,,242,24,0,"#GFTnamídia:, #teamGFT,, #GFTnaMídia#TecnologiadaInformação#Educação'",linkedin
38,gft-group,,2020-12-19,"On the first day of the Singapore FinTech Festival week, read our latest exciting #success story about the arrival of the customer-centric bank of the future. Mox Bank has recently become recognised as one of the leading virtual #bank projects in the world, gaining momentum & new customers at a rapid rate. Discover here how we have been able to support #MoxBank in the delivery of this ambitious project. #AWS #ThoughtMachine #digitaltransformation You can also find out more about our presence at the #SGFinTechFest here https://bit.ly/3mJ31nt'",,,,22,0,0,"#success, #bank, #MoxBank, #AWS, #ThoughtMachine, #digitaltransformation, #SGFinTechFest",linkedin
39,gft-group,,2020-12-19,"During the Singapore FinTech Festival this week, we are delighted to be showcasing our exciting #DLT & #crypto capabilities. Getting the right use case for a DLT application, building out smart contract driven DLT networks and developing infrastructure and security systems for crypto-exchanges are non-trivial pursuits. With a broad experience in this field, GFT has a wide range of accelerators and assets that can help you get off the ground quickly. #BlockchainYou can also learn more about our expertise and find out more about our presence at the #SGFinTechFest here https://bit.ly/3mJ31nt'",,,,21,0,0,"#DLT, #crypto, #BlockchainYou, #SGFinTechFest",linkedin
40,gft-group,,2021-01-18,"São 1.500 histórias, sonhos, projetos e vidas de todo o Brasil que fizeram o nosso 2020 ainda mais especial.Em 2021, seremos muito mais!#VempraGFT#TeamGFT#Somos1500'",,,,237,30,4766,#VempraGFT#TeamGFT#Somos1500',linkedin
41,gft-group,,2020-12-19,"GFT’s proven methodology could be the key to realising the huge benefits of your modern application development, with our processes leading to smaller, faster and safer application changes, where everything is automated. Our get started with Monolith to #Microservices guide demonstrates our robust framework as well as proof of our success in this area. #SGFinTechFestYou can also find out more details about our presence at the last day of the Singapore FinTech Festival here https://bit.ly/3mJ31nt'",,,,46,1,0,"#Microservices, #SGFinTechFestYou",linkedin
42,gft-group,,2020-12-19,"Are you launching a new virtual #bank or embarking on a full #digitaltransformation by replacing or extending old legacy systems? You have the possibility to leverage GFT’s digital banking accelerator, BankLite, to enable a fast deployment of a new #cloud based digital bank – today.Find out more about this exciting capability and our virtual booth at this week’s Singapore FinTech Festival #SGFinTechFest here https://bit.ly/3mJ31nt'",,,,57,1,0,"#bank, #digitaltransformation, #cloud, #SGFinTechFest",linkedin
43,gft-group,,2021-02-03,"💎 We are proud to announce that #GFTPoland has been named among #DiamentyForbesa for 2021 – the prestigious list of Poland’s most dynamically growing organizations, announced by Forbes Polska, one of the world’s best known business opinion making magazines. - Last year was spectacular for us, we have expanded our business outside of #banking into #Industry40 and added over 200 people to the organization. We have launched new projects and are now hiring people from across Poland, to allow us to work with talented people from the entire country – says Wojciech Mach, Managing Director, GFT Poland.The prestigious distinction is especially noteworthy in a time of economic turbulence caused by the COVID-19 pandemic. Despite the situation, GFT Poland managed to deliver both excellent business results and a stable work environment for almost 1000 employees. The award serves as fantastic recognition that we did really well in 2020!Read more below (in Polish) ⤵️'",,,,46,1,0,"#GFTPoland, #DiamentyForbesa, #banking, #Industry40",linkedin
44,gft-group,,2020-12-19,Join GFT tomorrow for #GoogleCloud High Performance Computing Days! Sign up now to our discussion entitled ‘HSBC Customer Spotlight: Migrating from on-premise to Google Cloud Platform’ featuring our very own Jonathan Watson on Thursday 3 December at 3:30PM. #HPCYou can register for this online event via our events page here!',,,,18,0,0,"#GoogleCloud, #HPCYou",linkedin
45,gft-group,,2020-12-19,Join GFT next week for Google Cloud High Performance Computing Days! Sign up now to our discussion entitled ‘HSBC Customer Spotlight: Migrating from on-premise to Google Cloud Platform’ featuring our very own Jonathan Watson on Thursday 3 December at 3:30PM.  #HPCYou can register for this online event via our events page here!',,,,52,2,0,#HPCYou,linkedin
46,gft-group,,2021-01-27,"Na era da #transformaçãodigital é preciso pensar primeiro no cliente.  A  GFT foi responsável pela automatização do Banco Espanhol Bankia e propôs o #WhatsApp como canal principal para realizar atendimentos mais rápidos sobre consultas regulares de hipotecas e empréstimos pessoais, por exemplo.  Quer saber mais sobre essa história de sucesso, acesse: ️ https://lnkd.in/gd3b8UN #bankia #whatsapp #gft #cloud #cx #banking'",,,,39,0,0,"#transformaçãodigital, #WhatsApp, #bankia, #whatsapp, #gft, #cloud, #cx, #banking'",linkedin
47,gft-group,,2021-01-27,"""#Subsurface is an international event that gathers the world's leading experts in #DataLake tech, including engineers & executives from Netflix, Microsoft, AWS, IBM and now: #GFTpoland!Piotr Kosmowski, Cloud Solution Architect & Kamil Owczarek, Head of Big Data Practice, invite you for a deep dive into advanced #DataLake development, including real-time processing and #ML integration, all based on their track record in ambitious, global reaching projects. If you want to be up to date with cutting edge #BigData solutions in the #Cloud, don't miss the lecture and the event! See you this Wednesday, 27th January, 7:20pm (CET) / 10:20 (PST). Register for free now! ⤵️#gftexperts #cloud #bigdata #datalake #machinelearning""",,,,19,0,0,"#Subsurface, #DataLake, #GFTpoland!Piotr, #DataLake, #ML, #BigData, #Cloud,, #gftexperts, #cloud, #bigdata, #datalake, #machinelearning""",linkedin
48,gft-group,,2020-11-19,"Pensar na saúde física e mental dos colaboradores é um dos principais valores para as empresas, principalmente agora, durante a pandemia. A GFT acredita nisso e está promovendo a semana da saúde, com bate-papos e palestras para todos os profissionais da companhia. Isso é ser #GreatPlaceToWork Confira as nossas dicas para ter uma vida mais leve. Você pratica alguma delas? Deixe nos nossos comentários! :)'",,,,65,4,0,#GreatPlaceToWork,linkedin
49,gft-group,,2021-01-27,GFT México presente en la lista de las mejores empresas para trabajar en tecnología 2021. https://lnkd.in/gCDUmM2#gftmexico #BestPlaceToCode',,,,26,1,0,"#gftmexico, #BestPlaceToCode'",linkedin
50,gft-group,,2021-01-18,Our challenge ⏩ Reduce contact query volumes by offering #WhatsApp as new customer support channel.Read to succeed: find out how WhatsApp and #instantmessaging boosts customer satisfaction and #contactcentre productivity in our latest success story with Bankia!#bankia #gft #cloud #cx #banking',,,,19,2,0,"#WhatsApp, #instantmessaging, #contactcentre, #bankia, #gft, #cloud, #cx, #banking'",linkedin
51,gft-group,,2021-01-27,The benefit ▶️ A #virtualbank that appeals to a tech-savvy generation!Do you want more information about our success story with Mox Bank?Read to succeed 🔽🔽🔽#gft #mox #digitalbank #banking #cloud',,,,52,0,0,"#virtualbank, #gft, #mox, #digitalbank, #banking, #cloud'",linkedin
52,gft-group,,2020-12-19,Joyeuses Fêtes de la part de toute notre équipe au recrutement!',,,,11,0,0,,linkedin
53,gft-group,,2021-02-03,The benefit ⏩ A permanent gain in operational efficiency and #customersatisfaction improved: #Bankia has taken this opportunity to increase customer engagement and grow the lifetime value of its customers.Read to succeed: find out how WhatsApp and instant messaging boosts customer satisfaction and #contactcentre productivity in our latest success story with Bankia! #whatsapp #gft #cloud #cx #banking',,,,40,0,0,"#customersatisfaction, #Bankia, #contactcentre, #whatsapp, #gft, #cloud, #cx, #banking'",linkedin
54,gft-group,,2020-12-19,Anche quando si può riunirsi solo virtualmente sempre uniti -team GFT 💯 % partecipazione!',,,,17,0,0,,linkedin
55,gft-group,,2021-01-18,Our engagement ▶️ Using an #AWS cloud-based virtual infrastructure and #DevOps methods to deliver an integrated banking solution!Do you want more information about our success story with Mox Bank?Read to succeed 🔽🔽🔽#gft #mox #digitalbank #banking #cloud',,,,66,0,0,"#AWS, #DevOps, #gft, #mox, #digitalbank, #banking, #cloud'",linkedin
56,gft-group,,2021-02-03,"The latest episode of GFT’s ‘Your immutable future’ #podcast, a regular podcast series examining Distributed Ledger Technologies #DLT and #Crypto, has arrived! In this edition, our host David Creer is joined by GFT specialists Lukas Lutz, Menno van Rijn & Alessandro Amicone to discuss #digital transformation in #industry using #blockchain. Listen here! https://bit.ly/2ME2MNr'",,,,25,0,0,"#podcast,, #DLT, #Crypto,, #digital, #industry, #blockchain.",linkedin
57,gft-group,,2020-12-19,"GFT s’amène au Saguenay-Lac-Saint-Jean!Nous vous présentons aujourd’hui la vidéo officielle de notre campagne de recrutement. Une production #LesFilmsdeLaBaie, une fière entreprise de la région du Saguenay-Lac-Saint-Jean. Merci à Philippe Belley et toute son équipe pour le travail réalisé! https://lnkd.in/eHRHXwVCurieux d’en savoir davantage sur notre campagne de recrutement? gft.com/saguenay'",,,,17,0,0,"#LesFilmsdeLaBaie,",linkedin
58,gft-group,,2020-10-20,"Já viu nosso programação para a 5º edição do GFT Technology Workshop? Vamos falar sobre as principais tendências de tecnologia como API, Hyperautomation e QA Engineering! Entre os speakers confirmados estão Claudio Acquaviva, arquiteto de software da Kong Inc, Alberto do Bem, da IBM, Wilson Amorim, analista de qualidade do Grupo GFT! Além de aprender mais sobre TI, você ainda pode concorrer a prêmios!  Fique ligado! O evento é neste sábado, 3, das 09h às 13h! Ainda dá tempo de se inscrever: https://bit.ly/3kpIinm'",,,,42,0,0,,linkedin
60,gft-group,,2020-12-19,Read the thoughts of our own Christopher Ortiz on the changing #digitalbanking landscape in Asia. #blockchain #financialservices #banks #transformation #sgfintechfest',,,,14,0,0,"#digitalbanking, #blockchain, #financialservices, #banks, #transformation, #sgfintechfest'",linkedin
61,gft-group,,2021-01-27,"Our engagement ⏩ As a result of an ongoing collaboration at Bankia’s AI lab, GFT proposed #WhatsApp as potential customer channel. The aim was to automate regular #customerservice enquiries about mortgages and personal loans, with optional human backup when needed.Read to succeed: find out how WhatsApp and instant messaging boosts customer satisfaction and #contactcentre productivity in our latest success story with Bankia!#bankia #gft #cloud #cx #banking'",,,,24,0,0,"#WhatsApp, #customerservice, #contactcentre, #bankia, #gft, #cloud, #cx, #banking'",linkedin
62,gft-group,,2020-10-20,GFT Group is hosting Webinar: The beauty of things. Would you like to attend?',,,,9,1,0,,linkedin
63,gft-group,,2021-01-18,Sending our warmest thoughts and best wishes for a wonderful #happynewyear! 🍀✨#gft #teamgft #digitalfirst',,,,115,0,1660,"#happynewyear!, #gft, #teamgft, #digitalfirst'",linkedin
64,gft-group,,2020-10-20,GFT Technologies terrà l’evento Webinar: The beauty of things. Vorresti partecipare?',,,,39,0,0,,linkedin
65,gft-group,,2021-01-18,"Perdeu a live de lançamento do GFT Start_UNI, nosso programa de estágio? Não tem problema, você pode assistir aqui e saber tudo sobre o novo bootcamp GFT START_UNI 2021, desenvolvido com a Digital Innovation One Inc., que faz parte do nosso programa de estágio. Ao finalizar todo o bootcamp, você terá a chance de participar do processo seletivo e conseguir uma vaga de estágio! Não vai perder essa oportunidade, né?  #gft #gftbrasil #grupogft #dio #digitalinnovationone #oportunidades #estagio #emprego #desenvolvimento #carreira #software'",,,,35,5,0,"#gft, #gftbrasil, #grupogft, #dio, #digitalinnovationone, #oportunidades, #estagio, #emprego, #desenvolvimento, #carreira, #software'",linkedin
66,gft-group,,2021-01-18,"""GFT s'amène au Saguenay-Lac-Saint-Jean!Tu habites dans la région du Saguenay et tu travailles dans le domaine des TI? Tu es finissant dans un programme en informatique et bientôt à la recherche de ton premier emploi dans le domaine? Saisis ta chance et joins-toi à notre équipe! Développeur, Analyste/Architecte fonctionnel & affaires, Chargé de projets/Scrum master, QA, envoie-nous ta candidature dès maintenant à : carriere.ca@gft.comgft.com/saguenay pour tous les détails de notre campagne.#teamGFT #Carriere #TI #Saguenay""",,,,16,0,0,"#teamGFT, #Carriere, #TI, #Saguenay""",linkedin
67,gft-group,,2020-12-19,"Christmas 🌲✨ is the celebration of love, joy and contemplation. Digital #seasonsgreetings from #GFT with the best wishes for you and your families. Stay safe!#teamgft #merrychristmas #digitalfirst'",,,,91,1,2693,"#seasonsgreetings, #GFT, #teamgft, #merrychristmas, #digitalfirst'",linkedin
68,gft-group,,2021-01-18,"#GFTnamídia: Estamos na EXAME!O nosso programa de estágio Start_Uni, em parceria com a Digital Innovation One Inc. está com as inscrições abertas! São 5.000 bolsas de estudo para jovens de todo o país e vamos contratar 70 estagiários para o nosso #teamGFT. A Diretora de Recursos Humanos da GFT, Fernanda dos Santos Rodrigues, falou com exclusividade para a EXAME como funciona o processo seletivo e quais os requisitos para entrar no #teamGFTQuer saber como? Leia na íntegra: https://lnkd.in/d5K5gHK#Exame #GFT #estágio #VempraGFT'",,,,26,2,0,"#GFTnamídia:, #teamGFT., #teamGFTQuer, #Exame, #GFT, #estágio, #VempraGFT'",linkedin
69,gft-group,,2021-01-18,"#GFTnaMídiaVocê sabe o que é ransomware? É um vírus muito conhecido no Brasil: o #malware bloqueia dados em um computador utilizando criptografia, causando o embaralhamento das informações e, consequentemente, a obstrução ao acesso desses conteúdos. Hoje, o país ocupa a segunda posição entre os mais atacados por esse tipo de ameaça. Além disso, o país detém a liderança mundial em #phishing, golpe utilizado pelo cibercriminoso para enviar o #ransomware e sequestrar ou invadir uma máquina, um banco de dados ou um sistema por meio de um e-mail falso.O nosso DPO, Wiliam Faria, escreveu sobre qual é a relação do ransomware com a LGPD, que entrou em vigor no ano passado, em um artigo para a imprensa. Acesse https://lnkd.in/eN_UA8m#LGPD #Ransomware #phishing'",,,,24,0,0,"#GFTnaMídiaVocê, #malware, #phishing,, #ransomware, #LGPD, #Ransomware, #phishing'",linkedin
70,gft-group,,2021-01-18,"Claudia Fabiola Amador Gomez, COO & Executive Delivery Manager de GFT México, nos platica el éxito de los semilleros de talento y cómo GFT México ha logrado implementar un programa global con éxito y beneficios para nuestros clientes. http://bit.ly/3ibPzHa#gftworldwide #gftmexico #digitalfirst'",,,,16,0,0,"#gftworldwide, #gftmexico, #digitalfirst'",linkedin
72,gft-group,,2020-12-19,"""Season's greetings 💙✨ from our global and passionate #socialmedia team! #Wohoo we did it - these special times #connected us even more! Thanks for your likes, comments and following our journey. 💙✨ Happy Holidays and stay safe, your #teamgft!#seasonsgreetings #happyholidays #gft #digitalfirst""",,,,132,9,2945,"#socialmedia, #Wohoo, #connected, #teamgft!#seasonsgreetings, #happyholidays, #gft, #digitalfirst""",linkedin
73,gft-group,,2020-11-19,Congratulations to Workplace Safety and Insurance Board (WSIB) for winning an Innovation Awards at the 2020 edition of Guidewire Connections! Félicitations à WSIB pour avoir gagné un «Innovation Awards» lors de l’édition 2020 du Guidewire Connections!#GuidewireConnections',,,,5,0,0,#GuidewireConnections',linkedin
75,gft-group,,2020-12-19,"O setor financeiro sabe o valor da combinação entre dados e inteligência. É preciso ser inovador e aprimorar a experiência do cliente, tornando a TI mais estratégica e menos operacional. Em parceria com a IBM, a GFT leva Inteligência Artificial para os serviços financeiros com o IBM Watson, que proporciona respostas rápidas, automação de processos, redução de custos e dados que geram insights valiosos para os negócios. Assista ao nosso vídeo para saber mais. Ficou interessado? Entre em contato conosco e entenda como aumentar sua competitividade.'",,,,32,0,4810,,linkedin
76,gft-group,,2020-12-19,"Listen here to our own Anja Schneider deliver GFT’s acceptance speech for our Network Products Guide IT World Industry #Award success. GFT won two golds and a silver in the #IT World Industry Awards: gold for Achievement of the Year in Learning and Development, gold for Achievement of the Year in People-Focused Workplace and silver for Best IT Company of the year IT (cloud/SaaS).Speaking at last night’s #SVUS Awards, Anja highlighted the progress of our ‘Making a Difference’ program which aims at empowering all our GFT staff to be the very best they can be. #developmentYou can also find out more about our award win here https://bit.ly/3bNWDa6'",,,,58,4,2311,"#Award, #IT, #SVUS, #developmentYou",linkedin
77,gft-group,,2021-01-18,"Saulo Santos, Head of Banking & Financial Services, é o novo integrante do board da GFT Brasil! Com larga experiência em instituições financeiras como Nacional, Bank Boston, Itaú e Banco Original, Santos chegou à GFT como business director e com o objetivo de experimentar novos desafios do outro lado do balcão. E deu certo: a sua área cresceu de três pessoas no time para 250. Quer saber mais sobre a trajetória do executivo? Acesse o nosso blog:  https://bit.ly/3hOMxsi'",,,,122,5,0,,linkedin
78,gft-group,,2020-12-19,"Check out the new episode of GFT Values Awards Poland - awards for all those who best represent the values of our company 🏆🏆. Last year, the award in the #TopTeam category went to Dragon, A. K. A. Mox. 50 high-class experts worked for over a year on building a virtual bank from scratch. Przemysław Juszkiewicz, Delivery Manager of the APAC team, talks about what it means to be a Top Team and who should receive this award today in Poland.'",,,,24,0,695,#TopTeam,linkedin
79,gft-group,,2020-12-19,"""▶️ Vous voulez en savoir plus sur l'#expertise de GFT avec les solutions logicielles de Guidewire Software?Téléchargez notre document « Point de vue » relatant les #meilleurespratiques pour l’implantation #Guidewire.⏩ https://lnkd.in/eUZFVHF#saviezvous #assurance #transformationnumerique #gft""",,,,18,0,575,"#expertise, #meilleurespratiques, #Guidewire.⏩, #saviezvous, #assurance, #transformationnumerique, #gft""",linkedin
81,gft-group,,2020-12-19,"""▶️ Do you want to know more about GFT's #expertise with Guidewire Software solutions?Download our Point of View paper covering #bestpractices for #Guidewire implementation ⏩ https://lnkd.in/dXCPBWV#didyouknow #insurance #digitaltransformation #gft""",,,,31,0,808,"#expertise, #bestpractices, #Guidewire, #didyouknow, #insurance, #digitaltransformation, #gft""",linkedin
82,gft-group,,2021-01-18,"Novo episódio do podcast GFT Tech no ar!Com o tema “Data Science utilizando processamento de linguagem natural (NLP)”, Robson Agapito Correa  conversa com o especialista Adriano V. S. da Silva  sobre o assunto.Você sabia que o #datascience está relacionado ao Big Data?Quer saber mais? Descubra, ouça agora: https://lnkd.in/gEgwdjx#PodcastGFT#DataScience'",,,,55,3,0,"#datascience, #PodcastGFT#DataScience'",linkedin
83,gft-group,,2020-10-20,GFT est toujours aussi fière d’encourager la relève en TI et de contribuer à l’offre de main d’œuvre qualifiée au Québec! Le projet de formation 42 Québec est une initiative qui rejoint parfaitement nos valeurs d’innovation et d’expertise.Au plaisir de collaborer avec les futurs(es) diplômés(ées)!',,,,10,0,0,,linkedin
85,gft-group,,2021-01-18,"Do you want to know how to bolster your #contactcentre, improve response time, reduce costs, optimise #customerexperience and analyse customer communication?Read to succeed ⏩ find out how WhatsApp and instant messaging boosts customer satisfaction and contact centre productivity in our latest success story with Bankia!#bankia #whatsapp #gft #cloud #cx #banking'",,,,63,0,0,"#contactcentre,, #customerexperience, #bankia, #whatsapp, #gft, #cloud, #cx, #banking'",linkedin
86,gft-group,,2020-12-19,"Somos uma das melhores empresas Great Place to Work® Brasil de tecnologia 2020 para se trabalhar!E o que temos a dizer com isso? Deixa que os nossos colaboradores te contam!Curta, compartilhe e comente aqui o que você achou do nosso vídeo. #VemprarGFT #GFTBrasil'",,,,131,24,2573,"#VemprarGFT, #GFTBrasil'",linkedin
87,gft-group,,2021-01-18,"Listen here to the latest episode of ‘Your immutable future’ podcast, a regular podcast series examining Distributed Ledger Technologies #DLT and #Crypto in the financial services industry. For the first episode of 2021, our host David Creer is joined by Bernhard Elsner from Digital Asset, along with other GFT DLT specialists, to discuss #DAML engineering. #blockchain #engineer https://bit.ly/3oDn47K'",,,,44,1,0,"#DLT, #Crypto, #DAML, #blockchain, #engineer",linkedin
88,gft-group,,2020-12-19,"""What does it mean to be COURAGEOUS in GFT? Kamil Trepczynski, our Senior Developer in Poland, who was awarded in this category of the Values Awards competition, will talk about it. In November 2019, Kamil told an extremely personal story of his illness so that we could use it in our campaign against prostate and testicular cancer. As part of the campaign, we encouraged our men to have preventive tests. The result: at least one human life saved. You can find the video accompanying the campaign here: https://bit.ly/3m8y9N8And in today's film Kamil will tell who he would nominate for the annual award for those who best represent the values of our company.""",,,,44,1,928,,linkedin
90,gft-group,,2021-01-18,"Você sabe o quanto o #MachineLearning está presente na sua vida? Das recomendações automáticas de quais filmes assistir, a melhor comida para pedir, quais produtos comprar e até mesmo aquela sugestão de amizade que aparece aqui no LinkedIn e outras redes…  O #aprendizadodemáquina consiste em extrair conhecimento dos dados. É um campo de pesquisa na interseção de estatística, inteligência artificial e ciência da computação e também é conhecido como análise preditiva ou aprendizado estatístico. O #machinelearning é o tema da nossa #terçatech de hoje. Quem escreve o blog de hoje é o Felipe T., desenvolvedor da GFT Brasil. Acesse e descubra mais sobre o assunto: https://bit.ly/3sshgk2  #terçatech#tuesdaytech#machinelearning'",,,,64,0,0,"#MachineLearning, #aprendizadodemáquina, #machinelearning, #terçatech, #terçatech#tuesdaytech#machinelearning'",linkedin
