id,company,post_title,post_date,post_text,Tipo,Assunto,Modelo,post_likes,post_comments,post_video_views,post_hashtags,origin
9,everis,,2021-02-14,"Ser capaz de gerar novas ideias e colocá-las em movimento, fazendo as coisas acontecerem. Esse é o ambiente que você vivenciará fazendo parte do time everis. Confira as vagas em aberto em Uberlândia! Confira: https://bit.ly/3cIZLnP #BEeveris #Career #everis #everisBrasil #MyeverisWorkplace'",,,,42,0,0,"#BEeveris, #Career, #everis, #everisBrasil, #MyeverisWorkplace'",linkedin
10,everis,,2021-02-10,"Oportunidades de trabalho para profissionais que estejam em São Paulo! Vem fazer a sua carreira na everis, uma multinacional presente em quase 20 países! Vem pra everis! Clique no link e se inscreva na vaga! https://bit.ly/3cIZLnP #BEeveris #Career #everis #everisBrasil #MyeverisWorkplace'",,,,45,0,0,"#BEeveris, #Career, #everis, #everisBrasil, #MyeverisWorkplace'",linkedin
11,everis,,2021-02-11,"O conceito de #ComputaçãoEspacial e #WebEspacial mostra potencial para se tornar o grande capacitador da massificação de servidores baseados em X-Reality, em grande escala, a um baixo custo e com muito mais engajamento: https://lnkd.in/gbQNpBm #everisBrasil #xReality'",,,,14,0,0,"#ComputaçãoEspacial, #WebEspacial, #everisBrasil, #xReality'",linkedin
12,everis,,2021-02-14,"Prevenção, eficiência e cuidado remoto, são os três pilares que sustentam o nosso portfólio de serviços e soluções tecnológicas para a área da saúde, o Forward Digital Health. Conte com a everis, consultoria global de negócios do grupo NTT Data, para começar a cuidar do amanhã, hoje! https://lnkd.in/dzkvCcK #everisBrasil #Healthcare #DigitalHealth'",,,,9,0,0,"#everisBrasil, #Healthcare, #DigitalHealth'",linkedin
13,everis,,2021-02-13,"Neste artigo, você pode dar uma olhada detalhada no poder da Inteligência Artificial no empreendedorismo na América Latina, acesse aqui: https://lnkd.in/gBy25Pa #everisBrasil #InteligenciaArtificial #Digital&Strategy #EstudoIA'",,,,27,0,0,"#everisBrasil, #InteligenciaArtificial, #Digital&Strategy, #EstudoIA'",linkedin
14,everis,,2021-02-12,"Vamos seguir o caminho da ciência e da tecnologia juntos!Queremos fazer a nossa parte para marcar o Dia Internacional das Mulheres e Meninas na Ciência, reiterando nossa responsabilidade como sociedade de ajudar a garantir que mais e mais meninas e mulheres realizem seus sonhos e desenvolvam seu potencial.#MulheresNaCiência #MeninasNaCiência #MulheresNaTecnologia #MulheresNaTI #everisBrasil'",,,,28,0,516,"#MulheresNaCiência, #MeninasNaCiência, #MulheresNaTecnologia, #MulheresNaTI, #everisBrasil'",linkedin
15,everis,,2021-02-10,"Deseja desencadear o pensamento disruptivo de forma simples e prática? Conheça 3 passos que o ajudarão, acesse: http://bit.ly/2M8NWhO #everisBrasil'",,,,19,0,0,#everisBrasil',linkedin
16,everis,,2021-02-13,Unir boas ideias com as melhores tecnologias disponíveis para o desenvolvimento da saúde é sempre o objetivo da everis. Participe da Digital Health Conference e debata sobre os avanços do setor com grandes empresas do segmento: https://lnkd.in/gxdjEke #everisBrasil #DigitalHealthConference',,,,12,0,0,"#everisBrasil, #DigitalHealthConference'",linkedin
17,everis,,2021-02-13,"Os assistentes de voz são aplicações criadas através da #IA para atender e responder às questões dos usuários. Queremos te apresentar nossa solução omnichannel de voz, eva: https://eva.bot/ #everisBrasil #IA #chatbot #ConversationalAI #everiseva'",,,,24,0,0,"#IA, #everisBrasil, #IA, #chatbot, #ConversationalAI, #everiseva'",linkedin
18,everis,,2021-02-13,"Acesse o estudo ""Inteligência Artificial nas grandes organizações Latino-Americanas"" e conheça insights dessa pesquisa que realizamos em parceria com o MIT Tech Review em Espanhol: https://lnkd.in/dq45j2R #everisBrasil #EstudoIA #Digital&Strategy'",,,,24,0,0,"#everisBrasil, #EstudoIA, #Digital&Strategy'",linkedin
19,everis,,2021-02-13,Startup brasileira Cor.Sync desevenvolveu um pequeno dispositivo e plataforma capaz de diagnosticar um ataque cardíaco em menos de 10 minutos e auxiliar na tomada de decisão clínica. Saiba mais em: https://lnkd.in/gcd5tWr (conteúdo em espanhol) #everisBrasil #everisNaMidia',,,,21,0,0,"#everisBrasil, #everisNaMidia'",linkedin
20,everis,,2021-02-10,"Estamos muito satisfeitos por ter tido o seminário especial da International Network of NextGen’s (NINGEN) da NTT DATA com mais de 50 jovens talentos de 7 países.Este foi o segundo seminário de Dina Alvarez da everis UK e o tema do seminário foi ""Nutrindo a Curiosidade Intercultural"". Tivemos um diálogo interativo sobre diferenças culturais e agora todos conhecemos as regras de ouro da colaboração intercultural.Muito obrigado à palestrante Dina Alvarez e à MC Julia Garcia Morales por sediarem um seminário tão agradável.Obrigado a todos por se juntarem a nós!Siga-nos @NTT DATA#nttdata #everis #NINGEN #global #talent #community #seminar #everisBrasil'",,,,12,0,0,"#nttdata, #everis, #NINGEN, #global, #talent, #community, #seminar, #everisBrasil'",linkedin
21,everis,,2021-02-12,Queremos escrever nosso futuro com você e contribuir juntos para um futuro melhor para aqueles que nos rodeiam. Embarque nesta com a gente! Confira as oportunidades de trabalho para profissionais que estejam em Florianópolis! Acesse: https://bit.ly/3cIZLnP #BEeveris #Career #everis #everisBrasil #MyeverisWorkplace',,,,30,1,0,"#BEeveris, #Career, #everis, #everisBrasil, #MyeverisWorkplace'",linkedin
22,everis,,2021-02-10,"Vem aí mais um super bootcamp da everis! São 7 mil bolsas de estudo gratuitas para formação em Kotlin Developer. Em parceria com a Digital Innovation One – DIO, essa é a oportunidade de você investir na carreira de tecnologia e ainda ter a chance de ser um dos 300 profissionais que serão contratados pela everis através da plataforma! Quer saber mais? Acompanhe a LIVE DE LANÇAMENTO que acontece hoje, às 20h no canal da DIO no Youtube: https://bit.ly/3aGGzqc #BEeveris #Career #everis #everisBrasil #MyeverisWorkplace'",,,,66,2,0,"#BEeveris, #Career, #everis, #everisBrasil, #MyeverisWorkplace'",linkedin
23,everis,,2021-02-10,"Acesse a Revista Radar, a revista do centro de hacking da everis, que traz temas atualizados sobre segurança cibernética. https://bit.ly/2NCsGBB #everisBrasil'",,,,33,0,0,#everisBrasil',linkedin
24,everis,,2021-01-18,"Para refletir: ""Prepare a sua equipe de RH para desenvolver a mentalidade e competências necessárias para acompanhar os desafios de negócio da era digital."" https://lnkd.in/gRN2mgZ #everisBrasil #RecursosHumanos #thefutureofwork #TalentoDigital'",,,,21,0,0,"#everisBrasil, #RecursosHumanos, #thefutureofwork, #TalentoDigital'",linkedin
25,everis,,2021-02-10,"Encuentro sobre el impacto de la #InteligenciaArtificial en la transformación de la industria aseguradora con Ubaldo González Benítez, CDO de MAPFRE España, y Javier Vicent del Nogal, Head of Devops Data & Data Architecture de AXA. Aún estás a tiempo de registrare. Te esperamos.'",,,,508,220,21025,#InteligenciaArtificial,linkedin
26,everis,,2021-02-11,"Os #chatbots têm diversas aplicações, que vão desde inspiração para uma compra até a conexão com um atendente para proporcionar a experiência ideal. Te convidamos a conhecer eva, nossa solução omnichannel de voz: https://eva.bot/ #everisBrasil #ConversationalAI #everiseva'",,,,28,0,0,"#chatbots, #everisBrasil, #ConversationalAI, #everiseva'",linkedin
27,everis,,2021-02-10,A nossa eva - everis Virtual Assistant usa capacidade cognitiva para oferecer respostas mais inteligentes às necessidades de seus pacientes. Descubra como isso permitiu melhorar o fluxo de comunicação e de trabalho em um grande hospital. Saiba mais https://lnkd.in/dzkvCcK #everisBrasil #Healthcare #DigitalHealth',,,,20,0,0,"#everisBrasil, #Healthcare, #DigitalHealth'",linkedin
28,everis,,2021-02-10,"Estamos em busca de profissionais que estejam em Florianópolis! Vem fazer a sua carreira na everis, uma multinacional presente em quase 20 países! Inscreva-se! https://bit.ly/3cIZLnP #BEeveris #Career #everisBrasil #MyeverisWorkplace'",,,,39,0,0,"#BEeveris, #Career, #everisBrasil, #MyeverisWorkplace'",linkedin
29,everis,,2021-02-10,"Com o trabalho remoto em alta devido à pandemia, as empresas estão engajadas em aprimorar a segurança da informação contra os crimes cibernéticos. Para Andréa Thomé, diretora de Cibersegurança da everis Brasil, as empresas evoluiram bastante e todos os departamentos devem participar deste processo evolutivo. Leia em: https://lnkd.in/dKHJYdB #everisBrasil #everisNaMidia'",,,,26,0,0,"#everisBrasil, #everisNaMidia'",linkedin
30,everis,,2021-02-10,O everisTalks Meetup: “Build a Bot: Vamos criar um robô inteligente?” já está disponível no Youtube everis Brasil! Para ver ou rever o conteúdo completo acesse: https://lnkd.in/gzGqxwD #everisBrasil #Strategy&Tech',,,,44,0,0,"#everisBrasil, #Strategy&Tech'",linkedin
31,everis,,2021-02-10,"A everis e a ClarkeModet, lançaram o Idectory uma plataforma que utiliza inteligência artificial para rastrear informações estratégicas de milhares de bancos de dados de patentes e artigos científicos, permitindo inclusive monitorar as inovações das empresas concorrentes. Entenda mais: http://bit.ly/3axcQAf #everisBrasil #everisNaMidia'",,,,17,0,0,"#everisBrasil, #everisNaMidia'",linkedin
32,everis,,2021-02-11,"Para estimular o diálogo sobre a maneira como estamos vivendo a transformação e, principalmente, o aprendizado que nos leva a este novo cenário, a everis e a NTT DATA promovem um encontro internacional em formato digital: o Digital Health Conference, um evento formado por diversos painéis de discussão sobre os impactos e experiências que o setor de saúde está enfrentando nos últimos meses e uma análise sobre o futuro. Em breve, você poderá participar deste evento gratuitamente! Acompanhe nossas redes sociais #everisBrasil #everis #DigitalHealthConference'",,,,28,0,0,"#everisBrasil, #everis, #DigitalHealthConference'",linkedin
33,everis,,2021-02-10,"A integração no mundo corporativo é algo de extrema importância para os resultados dos negócios e, é tema deste #podcast 🎧Spotify https://spoti.fi/2LqhQy4 Google http://bit.ly/3tlTgzk Apple http://apple.co/3tui740 Deezer http://bit.ly/3aDJjVD Tunein http://bit.ly/3pRyJjY #verisBrasil #ITServices #everisTalksPodcast'",,,,16,0,0,"#podcast, #verisBrasil, #ITServices, #everisTalksPodcast'",linkedin
34,everis,,2021-02-10,"A #everisBrasil obteve selo de excelência em RH emitido pela Top Employers Institute, que analisa práticas de gestão através de um processo de pesquisa que dura em média seis meses com todas as respostas auditadas independetemente. Leia em: https://bit.ly/3cEr7xs #everisBrasil #everisNaMidia'",,,,40,0,0,"#everisBrasil, #everisBrasil, #everisNaMidia'",linkedin
35,everis,,2021-02-10,"La cooperación y el intercambio de información e ideas por parte de los profesionales y directivos del sector #retail son ahora más útiles y necesarias que nunca. Por ello, queremos que sigas disfrutando en directo de esta nueva edición de #BFS2021, donde David Ubide acompañará a las voces más acreditadas de la industria de la moda.¡No te lo pierdas! https://lnkd.in/dsir_A4'",,,,60,2,0,"#retail, #BFS2021,",linkedin
36,everis,,2021-02-10,"#everisMéxico presentó ante las más representativas universidades de la región Bajío, el Centro de Alto Rendimiento IT #everisBajío. En el evento los representantes de las instituciones educativas manifestaron su interés en formar alianzas para reclutar y formar el mejor talento del mercado al servicio de la transformación de esta geografía. Gracias #UGTO #ITLeon #TalentoUP #IPN'",,,,31,2,0,"#everisMéxico, #everisBajío., #UGTO, #ITLeon, #TalentoUP, #IPN'",linkedin
37,everis,,2021-02-12,"Na everis acreditamos que, num ambiente de liberdade responsável, cada profissional gera a sua #energia da forma mais eficiente e equilibrada, direcionando-a para fluir positivamente para quem o rodeia, fazendo o que gosta e colocando o coração no que faz. Sinta a energia e descubra a sua oportunidade! https://lnkd.in/gJXgbjb #everisBrasil #BEeveris #Careers #EnergyBeats'",,,,68,0,676,"#energia, #everisBrasil, #BEeveris, #Careers, #EnergyBeats'",linkedin
38,everis,,2021-02-03,Acesse nosso estudo conheça essa realidade: https://lnkd.in/gRN2mgZ #everisBrasil #RecursosHumanos #thefutureofwork #TalentoDigital',,,,21,0,0,"#everisBrasil, #RecursosHumanos, #thefutureofwork, #TalentoDigital'",linkedin
39,everis,,2021-02-03,Acesse nosso estudo conheça essa realidade: https://lnkd.in/gRN2mgZ #everisBrasil #RecursosHumanos #thefutureofwork #TalentoDigital',,,,10,0,0,"#everisBrasil, #RecursosHumanos, #thefutureofwork, #TalentoDigital'",linkedin
40,everis,,2021-02-03,Na última semana a #everisBrasil foi reconhecida pelo sexto ano consecutivo como uma empresa Top Employer na avaliação da Top Employers Institute. Essa conquista não seria possível sem o emprenho de cada um de nossos profissionais. Agradecemos a cada um dos talentos everis que fazem parte desta conquista! #TopEmployers2021 #MyeverisWorkplace #everis #BEeveris #Career',,,,236,3,2838,"#everisBrasil, #TopEmployers2021, #MyeverisWorkplace, #everis, #BEeveris, #Career'",linkedin
41,everis,,2021-02-10,"Especialistas do “Digital Technology Innovation everis”, conversam, neste #podcast, sobre o estudo “X-Reality Inside 2020”, elaborado pela everis, que traz o mapeamento atualizado de todo o ecossistema deste setor 🎧Spotify http://spoti.fi/38k9fFwGoogle http://bit.ly/3i0MERXApple http://apple.co/35gUJwuDeezer http://bit.ly/3onhXsfTuneIn http://bit.ly/35ij8BL#everisBrasil #everisTalksPodcast'",,,,23,1,0,"#podcast,, #everisBrasil, #everisTalksPodcast'",linkedin
42,everis,,2021-02-10,"Prevenção de doenças, diminuição do custo dos cuidados médicos e recomendar os melhores caminhos de tratamentos de forma otimizada. Estes são os principais pilares do Forward Digital Health da everis, consultoria global de negócios parte do grupo NTT Data. Saiba mais sobre este e os demais pilares: https://lnkd.in/dzkvCcK #everisBrasil #Healthcare #DigitalHealth'",,,,23,0,0,"#everisBrasil, #Healthcare, #DigitalHealth'",linkedin
43,everis,,2021-02-03,"Em aliança com o MIT Tech Review, realizamos uma detalhada investigação para entender a visão, estratégia e adoção de #IA nas grandes organizações Latino Americanas. Acesse estudo e conheça os resultados: https://lnkd.in/dq45j2R #everisBrasil #InteligenciaArtificial #Digital&Strategy #EstudoIA'",,,,19,0,0,"#IA, #everisBrasil, #InteligenciaArtificial, #Digital&Strategy, #EstudoIA'",linkedin
44,everis,,2021-02-13,"Estar à frente com Forward Digital Health é ter serviços e soluções tecnológicas para a área da saúde que parecem vir do futuro. Entre em contato com a everis, consultoria global de negócios parte do grupo NTT Data e, comece a cuidar do amanhã, hoje! Saiba mais:  https://lnkd.in/dzkvCcK #everisBrasil #Healthcare #DigitalHealth'",,,,16,0,0,"#everisBrasil, #Healthcare, #DigitalHealth'",linkedin
45,everis,,2021-02-10,O futuro dos #chatbots é que as empresas automatizarão pagamentos simples e permitirão que usuários paguem diretamente por chat ao vivo ou aplicativos. Como sua empresa está se preparando para este momento? https://eva.bot/ #everisBrasil #IA #ConversationalAI #everiseva',,,,17,0,0,"#chatbots, #everisBrasil, #IA, #ConversationalAI, #everiseva'",linkedin
46,everis,,2021-02-10,"Deseja desencadear o pensamento disruptivo de forma simples e prática? Conheça 3 passos que o ajudarão, acesse: http://bit.ly/2M8NWhO #everisBrasil'",,,,11,0,0,#everisBrasil',linkedin
47,everis,,2021-02-03,"Open innovation Contest 11 chega ao final e, consagra como vencedora a startup irlandesa Inspktlabs, com uma plataforma de visão computacional focada na automação de inspeções, que receberá um investimento da NTT DATA de 10 milhões de ienes em suporte de colaboração. O prêmio de reconhecimento, Audience award, foi para a israelense NoTraffic, que apresentou uma plataforma de gerenciamento de tráfego autônomo. https://lnkd.in/g8kK7fZ #everisBrasil #Strategy&Tech #OpenInnovation #OIC11'",,,,33,0,0,"#everisBrasil, #Strategy&Tech, #OpenInnovation, #OIC11'",linkedin
48,everis,,2021-02-10,"Oportunidades de trabalho para profissionais que estejam em São Paulo! Vem fazer a sua carreira na everis, uma multinacional presente em quase 20 países! Vem pra everis! Clique no link e se inscreva na vaga! https://bit.ly/3cIZLnP #BEeveris #Career #everis #everisBrasil #MyeverisWorkplace'",,,,21,1,0,"#BEeveris, #Career, #everis, #everisBrasil, #MyeverisWorkplace'",linkedin
49,everis,,2021-02-10,Queremos escrever nosso futuro com você e contribuir juntos para um futuro melhor para aqueles que nos rodeiam. Nós acreditamos que tudo é possível. Embarque nesta com a gente! Sinta a energia! https://lnkd.in/gJXgbjb #everisBrasil #BEeveris #Careers #EnergyBeats',,,,25,0,0,"#everisBrasil, #BEeveris, #Careers, #EnergyBeats'",linkedin
50,everis,,2021-02-10,"“Não foram os filhos que invadiram nossas reuniões, mas sim o trabalho que invadiu as nossas casas – e eles precisam estar nos nossos currículos”. Realizamos na última semana mais uma edição do Happy Hour com Ricardo Neves, nosso CEO, para todos os profissionais da everis no Brasil. Desta vez, além dos updates da companhia, tivemos a participação de Camila Antunes, Co-fundadora da Filhos no Currículo, para um bate-papo muito interessante sobre parentalidade e a fusão entre nossa vida pessoal e profissional, acelerada durante esta pandemia. Confira no vídeo parte dessa discussão. #everisBrasil'",,,,134,6,0,#everisBrasil',linkedin
51,everis,,2021-02-10,Você é Desenvolvedor (a) JAVA e Desenvolvedor (a) Android? Já pensou em desenvolver sua carreira em uma multinacional presente em quase 20 países? Vem pra everis! Clique no link e se inscreva! https://bit.ly/3cIZLnP #MyeverisWorkplace #BEeveris #Career #everis #everisBrasil',,,,21,0,0,"#MyeverisWorkplace, #BEeveris, #Career, #everis, #everisBrasil'",linkedin
52,everis,,2021-02-03,É hexa! Pelo sexto ano consecutivo a #everisBrasil foi reconhecida como uma empresa Top Employer! A premiação é realizada pelo Top Employers Institute e avalia a aderência das empresas às melhores práticas de recursos humanos do mercado. Agradecemos a cada um dos profissionais everis que fazem parte desta conquista! #TopEmployers2021 #MyeverisWorkplace #BEeveris #Career',,,,174,6,0,"#everisBrasil, #TopEmployers2021, #MyeverisWorkplace, #BEeveris, #Career'",linkedin
53,everis,,2021-02-03,"Especialistas do “Digital Technology Innovation everis”, conversam, neste #podcast, sobre o estudo “X-Reality Inside 2020”, elaborado pela everis, que traz o mapeamento atualizado de todo o ecossistema deste setor 🎧Spotify http://spoti.fi/38k9fFwGoogle http://bit.ly/3i0MERXApple http://apple.co/35gUJwuDeezer http://bit.ly/3onhXsfTuneIn http://bit.ly/35ij8BL#everisBrasil #everisTalksPodcast'",,,,15,0,0,"#podcast,, #everisBrasil, #everisTalksPodcast'",linkedin
54,everis,,2021-02-10,Aqui na #everis a sua energia conecta você ao seu ambiente de trabalho e você pode adaptar os ritmos  síncronos e assíncronos para que todos possam equilibrar sua energia e a do grupo se expanda. A energia que faz você crescer! Junte-se a nós! https://lnkd.in/gJXgbjb #everisBrasil #BEeveris #Careers #EnergyBeats',,,,10,0,0,"#everis, #everisBrasil, #BEeveris, #Careers, #EnergyBeats'",linkedin
55,everis,,2021-02-03,"A nova head de cybersegurança da everis Brasil, Andréa Thomé, tem a missão de estruturar essa área no Brasil e apresentar a nova solução de Cybersecurity desenvolvida pela companhia aos clientes nacionais. Além do invejável currículo, com mais de 26 anos de experiência e passagens por grandes corporações, a executiva também contribui para o empoderamento feminino como líder brasileira da WOMCY – LATAM Women in Cybersecurity. https://lnkd.in/g9FbS6e #everisBrasil #everisNaMidia'",,,,61,3,0,"#everisBrasil, #everisNaMidia'",linkedin
56,everis,,2021-02-10,"O conceito de #ComputaçãoEspacial e #WebEspacial mostra potencial para se tornar o grande capacitador da massificação de servidores baseados em X-Reality, em grande escala, a um baixo custo e com muito mais engajamento. https://lnkd.in/gbQNpBm #everisBrasil #xReality'",,,,18,0,0,"#ComputaçãoEspacial, #WebEspacial, #everisBrasil, #xReality'",linkedin
57,everis,,2021-02-03,As organizações estão preparadas para a transformação da área de talentos com visão de futuro? Acesse nosso estudo e conheça essa realidade: https://lnkd.in/gRN2mgZ #everisBrasil #RecursosHumanos #thefutureofwork #TalentoDigital',,,,17,0,0,"#everisBrasil, #RecursosHumanos, #thefutureofwork, #TalentoDigital'",linkedin
58,everis,,2021-01-27,"O ehCOS Remote Health é uma solução tecnológica de teleatendimento médico, para atender pacientes com segurança, sem que tenham que sair de casa. Que tem como objetivo ajudar a reduzir a pressão no sistema de saúde, garantir um modelo de atendimento focado na comunidade e proteger a saúde dos profissionais. Conheça mais sobre essa tecnologia: https://lnkd.in/dzkvCcK #everisBrasil #Healthcare #DigitalHealth'",,,,35,3,707,"#everisBrasil, #Healthcare, #DigitalHealth'",linkedin
59,everis,,2021-02-03,"Deseja desencadear o pensamento disruptivo de forma simples e prática? Conheça 3 passos que o ajudarão, acesse: http://bit.ly/2M8NWhO #everisBrasil'",,,,11,0,0,#everisBrasil',linkedin
60,everis,,2021-02-10,"Cerca de 80% dos líderes entrevistados para o estudo Agile concordam que, graças à adoção desta metodologia, as equipes de trabalho são multidisciplinares e capazes de integrar diferentes pontos de vista sob um esquema de trabalho e um objetivo comum. https://lnkd.in/gfNKjCJ #everisBrasil #Agile #EstudoAgile'",,,,38,0,0,"#everisBrasil, #Agile, #EstudoAgile'",linkedin
61,everis,,2021-01-18,"Estar à frente é focar em prevenção e assim melhorar a eficiência e os resultados das operações médicas. everis, consultoria global de negócios parte do grupo NTT Data, oferece o melhor portfólio de soluções tecnológicas e de serviços. Conheça o Forward Digital Health. Saiba mais: https://lnkd.in/dzkvCcK #DigitalHealth #Healthcare #everisBrasil'",,,,27,0,0,"#DigitalHealth, #Healthcare, #everisBrasil'",linkedin
62,everis,,2021-02-03,"Velocidade no atendimento é uma das principais exigências dos consumidores de hoje em dia. Quão rápido sua empresa consegue ajudá-los no momento em que eles precisam? É parte da experiência do cliente e é o que fará sua empresa se diferenciar. Mas o que está ajudando as empresas a conseguirem atender seus clientes com essa velocidade? Os chatbots. Conheça everis eva, nossa solução omnichannel de voz: https://eva.bot/ #everisBrasil #IA #chatbot #ConversationalAI #everiseva'",,,,18,0,0,"#everisBrasil, #IA, #chatbot, #ConversationalAI, #everiseva'",linkedin
63,everis,,2021-02-03,"Levamos aos nossos clientes dados importantes sobre o estudo realizado em parceria com a MIT Tech Review, em uma sessão virtual sobre #IA nas Grandes Organizações Latino- Americanas, com a presença de Silvana Pioli Vallim, Ivan Brum e Lluis Quiles Ardila, Diretora de Negócios, Diretor Data & Analytics e Diretor de Data Science da everis Brasil. Contamos também com uma experiência exclusiva sobre cafés selecionados, organizado por GELMA FRANCO, proprietária do IL Barista e apresentados por Paula Varejão, especialista em cafés e apresentadora do programa Tá na Hora do Café #everisBrasil'",,,,55,1,0,"#IA, #everisBrasil'",linkedin
64,everis,,2021-02-03,"O objetivo do framework Noronha é facilitar a adesão de práticas MLOps em equipes de #IA, através de uma arquitetura genérica o suficiente para garantir liberdade de inovação com o surgimento de novas tecnologias. Saiba mais, acesse: https://lnkd.in/gtFe7CM #everisBrasil'",,,,19,0,0,"#IA,, #everisBrasil'",linkedin
65,everis,,2021-02-03,"Acesse a Revista Radar, a revista do centro de hacking da everis, que traz temas atualizados sobre segurança cibernética. https://bit.ly/2NCsGBB #everisBrasil'",,,,20,0,0,#everisBrasil',linkedin
66,everis,,2021-01-18,"Saiba como as soluções oferecidas pela NTT DATA tem transformado a Community Health Plan de Washington, USA, um plano de saúde local, sem fins lucrativos e que atende a comunidade carente do estado, inovando e oferecendo maior facilidade e agilidade para membros e provedores. https://lnkd.in/dzkvCcK #everisBrasil #Healthcare #DigitalHealth'",,,,26,1,0,"#everisBrasil, #Healthcare, #DigitalHealth'",linkedin
67,everis,,2021-02-03,"O Innovation Chase é um programa da everis Brasil em parceria com universidades, que promove o apoio por meio de mentorias, dos profissionais everis especializados, para grupos de alunos que estão em fase de formação! everis XR Challenge 2020 - FIAP, chega agora à fase de pós mentoria. Conheça Disturb VR, a equipe vencedora desta edição! #everisXRChallengeFIAP #Strategy&Tech #everisBrasil #InnovationChase'",,,,56,1,0,"#everisXRChallengeFIAP, #Strategy&Tech, #everisBrasil, #InnovationChase'",linkedin
68,everis,,2021-02-03,"Quais práticas você gostaria que fossem implementadas para o trabalho remoto? Neste artigo deixamos uma análise deste cenário, acesse: https://lnkd.in/gh8rzQD #everisBrasil'",,,,30,1,0,#everisBrasil',linkedin
