id,company,post_title,post_date,post_text,Tipo,Assunto,Modelo,post_likes,post_comments,post_video_views,post_hashtags,origin
354,everis,,2020-11-19,"Com a @PrograMaria e a @Laboratória, formamos e apoiamos a entrada de mulheres no mercado de tecnologia. Com a @Educafro, oferecemos à população afro-brasileira formação para promover seu empoderamento e mobilidade social. Com nossos amigos da @SerEspecial promovemos a inclusão social e profissional de pessoas com deficiência no mercado de trabalho. E com @DIO, disponibilizamos 15 mil bolsas de estudo em tecnologia para democratizar o acesso à informação e oferecer novas oportunidades e perspectivas de carreira. Na #everis, contrataremos mais de 800 desses talentos. Esperamos por você! #MyeverisWorkplace #BEeveris #everisBrasil'",,,,28,5,0,"#everis,, #MyeverisWorkplace, #BEeveris, #everisBrasil'",linkedin
355,everis,,2020-11-19,"No dia 02 de dezembro de 2020 às 9h30 teremos o próximo everis Talks Round Table ""A expansão da agilidade no Brasil, a adoção da metodologia ágil como grande aliada na evolução dos negócios"". Evento online conduzido por Ewerton Santos, Head do Centro de Excelência ágil da everis Brasil, com nossos convidados Edson Portilho, Executivo de Tecnologia / Especialista em Modelo de Trabalho Digital do Banco Itaú e Raphael Albino, Agile Manager na Nubank Participe: https://bit.ly/round-agil #everisBrasil #Strategy&Tech'",,,,27,1,0,"#everisBrasil, #Strategy&Tech'",linkedin
356,everis,,2020-12-19,"Na última semana realizamos o everisTalks Meetup: “Descubra na prática, como aumentar a satisfação dos clientes com Salesforce Field Service” e ele já está disponível no Youtube da everis Brasil, para você rever o conteúdo completo! Acesse: https://lnkd.in/d-F6HUM #everisBrasil #Strategy&Tech'",,,,15,0,0,"#everisBrasil, #Strategy&Tech'",linkedin
357,everis,,2020-12-19,"Consultoria de negócios e TI do Grupo NTT Data, a everis identifica no setor de telecomunicações aumento nos investimentos em redes com arquiteturas abertas e virtualizadas na nuvem. https://lnkd.in/gNJDSpC #everisBrasil #everisNaMidia'",,,,6,0,0,"#everisBrasil, #everisNaMidia'",linkedin
358,everis,,2020-11-19,"Na próxima quinta-feira, 26.11 às 19h, participe do everisTalks Meetup “Descubra na prática, como aumentar a satisfação dos clientes com Salesforce Field Service”. O evento virtual será apresentado por Eduardo Galante, Salesforce architect na everis Brasil e Leonardo Arjoni, Salesforce Field Service expert na everis Brasil. Inscreva-se: https://lnkd.in/ghhpHzB #everisBrasil #Strategy&Tech'",,,,24,0,0,"#everisBrasil, #Strategy&Tech'",linkedin
359,everis,,2020-12-19,"60% das empresas pesquisadas para o estudo ""Inteligência Artificial nas grandes organizações Latino-Americanas"" afirmam que ainda têm um longo caminho para a adoção de IA no dia-a-dia, confirmam os benefícios que a IA pode lhes trazer, mas ainda não começaram a trabalhar com a tecnologia. Acesse estudo e saiba o nível de adoção de #IA nas organizações da região: https://lnkd.in/dq45j2R #everisBrasil #EstudoIA #Digital&Strategy'",,,,20,2,0,"#IA, #everisBrasil, #EstudoIA, #Digital&Strategy'",linkedin
360,everis,,2020-11-19,"Na última semana aconteceu o evento Semana dos Voluntários Telefônica Vivo organizada pela @fundacaotelefonicavivo! As atividades realizadas nessa semana beneficiaram 50 cidades do Brasil, beneficiando 64 projetos (Instituições apoiadas) e 47.660 de pessoas. Neste ano, a everis Brasil teve a oportunidade de participar como apoiadora da montagem do Espaço Maker, que incentiva crianças e jovens no desenvolvimento de novas ideias e criatividade, para projetos desenvolvidos em laboratórios de robótica na Associação Beneficente Dikaion, beneficia, mais de 13.500 famílias em atendimentos indiretos na área social. Confira um pouco de como foi o evento! #VivoPraIsso #souvoluntarioFTV #everis #everisBrasil Marco Galaz Santiago Chavert Tosa'",,,,11,0,0,"#VivoPraIsso, #souvoluntarioFTV, #everis, #everisBrasil",linkedin
361,everis,,2020-12-19,"O tema desde #podcast é o ganho de eficiência e produtividade utilizando testes de API e Microserviços, ouça 🎧Spotify https://spoti.fi/3m7MAAO Google https://bit.ly/2UYmMvfApple https://apple.co/3q2IqMYDeezer https://bit.ly/3l6UVncTunein https://bit.ly/2V15zB9#everisBrasil #everisTalks #ITServices'",,,,17,1,0,"#podcast, #everisBrasil, #everisTalks, #ITServices'",linkedin
362,everis,,2020-11-19,"Modernizar meios de pagamentos é questão de sobrevivência, saiba mais sobre o PIX e o pagamento digital instantâneo: https://bit.ly/3lk7Hzt #everisBrasil #ITServices'",,,,28,0,0,"#everisBrasil, #ITServices'",linkedin
363,everis,,2020-12-19,#everis e #MIT fazem estudo que aponta a maior adoção de Metodologias Ágeis nas áreas de TI e Software. https://lnkd.in/gfNKjCJ #everisBrasil #EstudoAgile #Agile',,,,29,0,0,"#everis, #MIT, #everisBrasil, #EstudoAgile, #Agile'",linkedin
364,everis,,2020-12-19,"Hoje, dia 30 de novembro celebramos o dia Internacional da Segurança da Informação! Neste ano um assunto que esteve em alta foi o vigor da LGPD, no Brasil e no mundo. Por isso, trouxemos algumas dicas que podem te ajudar a manter suas informações seguras:* Cadastre senhas fortes, com letras (maiúsculas e minúsculas), números e caracteres especiais;*Compre online por meio de lojas reconhecidas; verifique se a loja possui o cadeado de segurança, no navegador.*Não clique em qualquer link que identificar na internet; supostas promoções ou fakenews “atrativas”, por exemplo, podem surgir apenas para fisgar seus dados por meio de links para malwares ou sites falsos. #everisBrasil'",,,,10,0,0,#everisBrasil',linkedin
365,everis,,2020-12-19,"A fundação everis, instituição que apoia e promove o empreendedorismo por meio de atividades em diferentes esferas da sociedade, acaba de lançar o Radar Empreenda Saúde, um mapeamento de startups e empresas da área da saúde, que participaram de uma ou mais edições do Prêmio Empreenda Saúde, trazendo um panorama desse ecossistema. https://lnkd.in/gdusg9s #everisBrasil #everisNaMidia'",,,,7,0,0,"#everisBrasil, #everisNaMidia'",linkedin
366,everis,,2020-11-19,"Estudo aponta que a adoção da filosofia ágil nas principais empresas da América Latina resultou em redução de custos e riscos, além de maior alinhamento da área de TI com o negócio. https://lnkd.in/gbyzDHR #everisNaMidia #everisBrasil'",,,,16,0,0,"#everisNaMidia, #everisBrasil'",linkedin
367,everis,,2020-12-19,"O tema do everis Talks Webinar de amanhã é: “Panorama do desenvolvimento híbrido entre homem e máquina na everis e benefícios”. Vamos abordar os desafios dessa jornada, focando em técnica, metodologia e planejamento e ainda, mostrar os ganhos e resultados. Inscreva-se! https://lnkd.in/g3jHnZD # ITServices #everisBrasil'",,,,24,1,0,"# ITServices, #everisBrasil'",linkedin
368,everis,,2020-11-19,"Na próxima quinta-feira, 26.11 às 19h, participe do everisTalks Meetup “Descubra na prática, como aumentar a satisfação dos clientes com Salesforce Field Service”. O evento virtual será apresentado por Eduardo Galante, Salesforce architect na everis Brasil e Leonardo Arjoni, Salesforce Field Service expert na everis Brasil. Inscreva-se: https://lnkd.in/ghhpHzB #everisBrasil #Strategy&Tech'",,,,37,0,0,"#everisBrasil, #Strategy&Tech'",linkedin
369,everis,,2020-12-19,"O Innovation Chase é um programa da everis Brasil em parceria com universidades, que promove o apoio por meio de mentorias, dos profissionais everis especializados, para grupos de alunos que estão em fase de formação! Na FIAP, a everis participa do everis XR Challenge FIAP e, no dia 02 de dezembro às 19h acontecerá a live de encerramento e agradecimento ao projeto 2020, que contou com a participação de 24 grupos FIAP! Para participar, fique ligado em nossas redes sociais, em breve publicaremos o link de acesso 😉 #InnovationChase #everisXRChallengeFIAP #Strategy&Tech #everisBrasil #everis'",,,,23,0,0,"#InnovationChase, #everisXRChallengeFIAP, #Strategy&Tech, #everisBrasil, #everis'",linkedin
370,everis,,2020-11-19,"Na próxima quinta-feira, 26.11 às 19h, participe do everisTalks Meetup “Descubra na prática, como aumentar a satisfação dos clientes com Salesforce Field Service”. O evento virtual será apresentado por Eduardo Galante, Salesforce architect na everis Brasil e Leonardo Arjoni, Salesforce Field Service expert na everis Brasil. Inscreva-se: https://lnkd.in/ghhpHzB #everisBrasil #Strategy&Tech'",,,,14,0,0,"#everisBrasil, #Strategy&Tech'",linkedin
371,everis,,2020-11-19,"Com o Salesforce Field Service, a equipe técnica possui todas as informações de forma rápida e organizada para realizar o trabalho de campo com qualidade e garantir a satisfação do cliente. https://lnkd.in/g9_ck23 #everisBrasil #Strategy&Tech'",,,,17,0,0,"#everisBrasil, #Strategy&Tech'",linkedin
372,everis,,2020-11-19,Parceria entre #everis e #MIIT Technology mapeia a evolução da adoção de Metodologias Ágeis em grandes empresas da América Latina. Veja o estudo completo: https://lnkd.in/gtnftuz #everisBrasil #EstudoAgile #Agile',,,,21,0,0,"#everis, #MIIT, #everisBrasil, #EstudoAgile, #Agile'",linkedin
373,everis,,2020-12-19,"Modernizar meios de pagamentos é questão de sobrevivência, saiba mais sobre o PIX e o pagamento digital instantâneo: https://bit.ly/3lk7Hzt #everisBrasil #ITServices'",,,,14,0,0,"#everisBrasil, #ITServices'",linkedin
374,everis,,2020-11-19,É com muito orgulho que comunicamos a nova especialização da everis como Adobe Experience Manager Sites na região Américas! Parabéns a todo time everis que participou do processo para atingirmos esse nível de parceria! #AdobePartners #AdobeSpecialized #everisBrasil',,,,83,1,0,"#AdobePartners, #AdobeSpecialized, #everisBrasil'",linkedin
375,everis,,2020-11-19,"X-reality no Brasil segue crescendo e potencial de expansão ainda é imenso! Há alguns anos, o mercado começou a desenvolver e investir em aplicações de realidade aumentada (AR), virtual (VR) e mista (MR) para diversos fins. https://lnkd.in/gmhCJMP #everisNaMidia #everisBrasil'",,,,5,0,0,"#everisNaMidia, #everisBrasil'",linkedin
376,everis,,2020-11-19,"Informamos que por problemas técnicos de conexão, precisaremos reagendar para a próxima quarta-feira, 25/11 às 19h o everisTalks Webinar “Qual é o papel dos testes na metodologia Ágil? ”, com Shirley Moura Silva e Francisco Laelson Rodrigues, da everis Brasil. Se você já está inscrito, não se preocupe, você receberá por e-mail a atualização, mas caso ainda não esteja inscrito, acesse: https://lnkd.in/g-SK8Af#ITServices #everisBrasil #everis'",,,,9,0,0,"#ITServices, #everisBrasil, #everis'",linkedin
377,everis,,2020-12-19,"Em alguns instantes, às 19h, se iniciará o everisTalks Meetup “Descubra na prática, como aumentar a satisfação dos clientes com Salesforce Field Service”. O evento virtual será apresentado por Eduardo Galante, Salesforce architect na everis Brasil e Leonardo Arjoni, Salesforce Field Service expert na everis Brasil. Inscreva-se: https://lnkd.in/ghhpHzB #everisBrasil #Strategy&Tech'",,,,16,0,0,"#everisBrasil, #Strategy&Tech'",linkedin
378,everis,,2020-11-19,"Fundação everis anuncia a startup Cor.Syn, como a vencedora do Empreenda Saúde 2020, pelo projeto de desenvolvimento do Cor.Sync Point of Care, uma solução completa para diagnóstico rápido e preciso de infarto. Saiba mais: https://lnkd.in/gHhVA9t #everisNaMidia #everisBrasil'",,,,16,0,0,"#everisNaMidia, #everisBrasil'",linkedin
379,everis,,2020-11-19,"Estudo realizado pela everis em parceria com a MIT Tech Review em espanhol, conclui que a adoção de filosofia ágil avança no Brasil com engajamento de liderança, foco no cliente e melhor mensuração dos resultados. https://lnkd.in/g6drWDp #everisBrasil #everisNaMidia'",,,,13,0,0,"#everisBrasil, #everisNaMidia'",linkedin
380,everis,,2020-11-19,"#everiseva é uma plataforma corporativa de voz, desenvolvida com #IA, para criar e gerenciar agentes virtuais que podem ser implantados em diferentes canais digitais: https://eva.bot/ #everisBrasil #ConversationalAI'",,,,26,0,0,"#everiseva, #IA,, #everisBrasil, #ConversationalAI'",linkedin
381,everis,,2020-11-19,"O conceito de #ComputaçãoEspacial e #WebEspacial mostra potencial para se tornar o grande capacitador da massificação de servidores baseados em X-Reality, em grande escala, a um baixo custo e com muito mais engajamento. https://lnkd.in/gbQNpBm #everisBrasil #xReality'",,,,18,0,0,"#ComputaçãoEspacial, #WebEspacial, #everisBrasil, #xReality'",linkedin
382,everis,,2020-12-19,"O Empreendimento colombiano de @Laura Velásquez Herrera foi premiado por sua inovação tecnologia e impacto social, sanitário e assistencial em zonas de difícil acesso aos sistemas de saúde. Parabenizamos a Arkangel AI #ColombiaGanaPremioseveris #everisColombia'",,,,19,0,0,"#ColombiaGanaPremioseveris, #everisColombia'",linkedin
383,everis,,2020-12-19,"O estudo sobre o uso da #InteligênciaArtificial, realizado em colaboração com o MIT Tech Review, diagnosticou o grau de desenvolvimento, conhecimento e implementação em seis países da América Latina. Baixe estudo: https://lnkd.in/dq45j2R #everisBrasil #EstudoIA #Digital&Strategy'",,,,29,0,0,"#InteligênciaArtificial,, #everisBrasil, #EstudoIA, #Digital&Strategy'",linkedin
384,everis,,2020-11-19,"As metodologias e frameworks mais destacados em nosso estudo Agile 2020 são Scrum (29%) e Kanban (24%) com uma evolução interessante em comparação com os anos anteriores. E você, qual prefere? Confira o estudo aqui: https://lnkd.in/gtnftuz #everisBrasil #EstudioAgile #Agile'",,,,63,0,0,"#everisBrasil, #EstudioAgile, #Agile'",linkedin
385,everis,,2020-11-19,"Qual é o papel dos testes na metodologia Ágil? Este é o tema do nosso próximo #everisTalks Webinar, que ocorrerá amanhã, 18 de novembro às 19h e será apresentado por Shirley Moura Silva e Francisco Laelson Rodrigues. Inscreva-se: https://lnkd.in/g-SK8Af#ITServices #everisBrasil #everis'",,,,17,0,0,"#everisTalks, #ITServices, #everisBrasil, #everis'",linkedin
386,everis,,2020-11-19,"Identificamos neste estudo sobre Inteligência Artificial nas grandes organizações Latino-Americanas que, profissionais com o talento necessário para desenvolver projetos de #IA são escassos e muito requisitados, por isto, um terço das empresas terceirizam o desenvolvimento de seus projetos. Conheça outros dados do estudo: https://lnkd.in/dq45j2R #everisBrasil #EstudoIA #Digital&Strategy'",,,,18,0,0,"#IA, #everisBrasil, #EstudoIA, #Digital&Strategy'",linkedin
387,everis,,2020-12-19,"Bruno Lopes Mello, Dojo Senpai (Facilitador) na everis Brasil e Mayckol Favarello, Agile Coach na everis Brasil,  trarão, neste #meetup, insights sobre como a importância de considerar os comportamentos que podem ser desenvolvidos pelos times dependendo da forma como as métricas e indicadores são abordados. https://lnkd.in/gBtgmAh #everisBrasil #Strategy&Tech'",,,,9,0,0,"#meetup,, #everisBrasil, #Strategy&Tech'",linkedin
388,everis,,2020-11-19,"everis cria academia nacional de talentos, um projeto, com 15.000 vagas, que visa capacitar e recrutar desenvolvedores juniores para atuar na organização. https://lnkd.in/g_Y2Jui #everisBrasil #everisNaMidia'",,,,42,2,0,"#everisBrasil, #everisNaMidia'",linkedin
389,everis,,2020-12-19,"No dia 02 de dezembro de 2020 às 9h30 teremos o próximo everis Talks Round Table ""A expansão da agilidade no Brasil, a adoção da metodologia ágil como grande aliada na evolução dos negócios"". Evento online conduzido por Ewerton Santos, Head do Centro de Excelência ágil da everis Brasil, com nossos convidados Edson Portilho, Executivo de Tecnologia / Especialista em Modelo de Trabalho Digital do Banco Itaú e Raphael Albino, Agile Manager na Nubank Participe: https://bit.ly/round-agil #everisBrasil #Strategy&Tech #everisTalksRoundTable'",,,,17,0,0,"#everisBrasil, #Strategy&Tech, #everisTalksRoundTable'",linkedin
390,everis,,2020-12-19,"No dia 02 de dezembro de 2020 às 9h30 teremos o próximo everis Talks Round Table ""A expansão da agilidade no Brasil, a adoção da metodologia ágil como grande aliada na evolução dos negócios"". Evento online conduzido por Ewerton Santos, Head do Centro de Excelência ágil da everis Brasil, com nossos convidados Edson Portilho, Executivo de Tecnologia / Especialista em Modelo de Trabalho Digital do Banco Itaú e Raphael Albino, Agile Manager na Nubank Participe: https://bit.ly/round-agil #everisBrasil #Strategy&Tech #everisTalksRoundTable'",,,,38,0,0,"#everisBrasil, #Strategy&Tech, #everisTalksRoundTable'",linkedin
391,everis,,2020-12-19,"Em nossa terceira edição do estudo Agile, observamos que DevOps é uma das principais prioridades para as empresas latino-americanas. Acesse o estudo e veja outros insights: https://lnkd.in/gfNKjCJ #everisBrasil #EstudioAgile #Agile'",,,,26,0,0,"#everisBrasil, #EstudioAgile, #Agile'",linkedin
392,everis,,2020-12-19,"A #WebEspacial mudará a maneira como clientes interagem com marcas e são engajados no consumo do produto, principalmente em economias como: indústrias de varejo, bancárias, automotivas e de bens de consumo. Conheça o panorama atual. https://lnkd.in/gbQNpBm#everisBrasil #XReality'",,,,12,0,0,"#WebEspacial, #everisBrasil, #XReality'",linkedin
393,everis,,2020-11-19,"O conceito de #ComputaçãoEspacial e #WebEspacial mostra potencial para se tornar o grande capacitador da massificação de servidores baseados em X-Reality, em grande escala, a um baixo custo e com muito mais engajamento. https://lnkd.in/gbQNpBm #everisBrasil #xReality'",,,,12,0,0,"#ComputaçãoEspacial, #WebEspacial, #everisBrasil, #xReality'",linkedin
394,everis,,2020-11-19,"Qual é o papel dos testes na metodologia Ágil? Este é o tema do nosso próximo #everisTalks Webinar, que ocorrerá na quarta-feira, 18 de novembro às 19h e será apresentado por Shirley Moura Silva e Francisco Laelson Rodrigues. Inscreva-se: https://lnkd.in/g-SK8Af#ITServices #everisBrasil #everis'",,,,41,0,0,"#everisTalks, #ITServices, #everisBrasil, #everis'",linkedin
395,everis,,2020-12-19,A maioria das organizações que contribuíram com nosso estudo Agile 2020 considera a velocidade de conclusão como uma das métricas centrais para medir o sucesso das práticas Agile. Confira o estudo aqui: https://lnkd.in/gfNKjCJ #everisBrasil #EstudioAgile #Agile',,,,19,0,0,"#everisBrasil, #EstudioAgile, #Agile'",linkedin
396,everis,,2020-11-19,"No último dia de #everisdigitalconference interna, Kazuhiro Gomi, Presidente & CEO NTT Research,  Marc Alba, Senior Vice President NTT, Presidente NTT Disruption e Regino Quirós, CEO Wave-8, falam sobre o futuro da tecnologia, e como ela deve ser usada em prol da sociedade, e propósito alinhado com o que realmente é importante em nossas vidas e nos move frente ao futuro. #everisenergy'",,,,19,0,0,"#everisdigitalconference, #everisenergy'",linkedin
397,everis,,2020-11-19,"Qual é o papel dos testes na metodologia Ágil? Este é o tema do nosso próximo #everisTalks Webinar, que ocorrerá dia 25 de novembro às 19h. Inscreva-se: https://lnkd.in/g-SK8Af#ITServices #everisBrasil #everis'",,,,12,0,0,"#everisTalks, #ITServices, #everisBrasil, #everis'",linkedin
398,everis,,2020-11-19,"Qual é o papel dos testes na metodologia Ágil? Este é o tema do nosso próximo #everisTalks Webinar, que ocorrerá na quarta-feira, 18 de novembro às 19h e será apresentado por Shirley Moura Silva e Francisco Laelson Rodrigues. Inscreva-se: https://lnkd.in/g-SK8Af#ITServices #everisBrasil #everis'",,,,30,0,0,"#everisTalks, #ITServices, #everisBrasil, #everis'",linkedin
399,everis,,2020-12-19,"Para debatermos o tema “Consciência Negra”, reunimos nossos colaboradores para um bate papo, que contou com a presença da Karina Reis, especialista na temática étnica-racial da Tree Diversidade, com mediação dos profissionais everis Brasil, Renata de Araújo Mário, Analista de Compras e Éder Alves da Silva, Desenvolvedor Mobile contratado pelo projeto Educafro Tech. O momento foi muito aproveitado e falamos sobre os conceitos usados na discussão sobre racismo estrutural, institucional e individual, branquitude, colorismo, privilégios, letramento racial e como desenvolver uma postura antirracista.#everisBrasil'",,,,38,1,0,#everisBrasil',linkedin
400,everis,,2020-11-19,"Na próxima quinta-feira, 26.11 às 19h, participe do everisTalks Meetup “Descubra na prática, como aumentar a satisfação dos clientes com Salesforce Field Service”. O evento virtual será apresentado por Eduardo Galante, Salesforce architect na everis Brasil e Leonardo Arjoni, Salesforce Field Service expert na everis Brasil. Inscreva-se: https://lnkd.in/ghhpHzB #everisBrasil #Strategy&Tech'",,,,5,0,0,"#everisBrasil, #Strategy&Tech'",linkedin
401,everis,,2020-12-19,"Estamos orgulhosos de anunciar o projeto colombiano vencedor do Prêmio everis Global 2020! Parabenizamos Laura Velásquez Herrera Co-fundadora de Arkangel AI #ColombiaGanaPremioseveris . O projeto foi o vencedor entre 10 países participantes e entre mais de 2.200 propostas recebidas, foi premiado com 60.000 euros e mentoria especializada para o desenvolvimento da aplicação. Agradecemos aos nossos parceiros na Colômbia: Ministério do Comércio, Sena, Câmera de Comércio de Bogotá, Innpulsa, Cem Emprende, Andi e Telefónica.'",,,,7,0,0,#ColombiaGanaPremioseveris,linkedin
402,everis,,2020-11-19,"Encerramos hoje com grande êxito, nossa primeira everis Internal Digital Conference, 4 dias de evento, 9 painéis diferentes, mais de 10 horas de conteúdo exclusivo para nossos colaboradores, 27 palestrantes e uma energia compartilhada imensurável. Esta é a energia que nos move e que nos faz vibrar e expandir juntos. Estamos mais conectados, e preparados do que nunca para novos desafios! #everisenergy #everisdigitalconference'",,,,9,0,0,"#everisenergy, #everisdigitalconference'",linkedin
403,everis,,2020-11-19,"No dia 11 de novembro, fomos reconhecidos mais uma vez como “Empresa Recrutadora do Ano” do @Revelo Awards 2020! Estar entre as melhores, é o resultado do trabalho de todo o time durante um ano cheio de desafios e grandes mudanças.  Anualmente, a Revelo elege as empresas que melhor seguiram as práticas de Recrutamento e Seleção na plataforma, envolvendo entrevistas com os candidatos, employer branding, feedbacks, contratações e outros tópicos relevantes. Já estamos ansiosos para edição de 2021! #everisBrasil #everis #BEeveris #Career #MyeverisWorkplace'",,,,285,9,0,"#everisBrasil, #everis, #BEeveris, #Career, #MyeverisWorkplace'",linkedin
404,everis,,2020-11-19,"Estudo realizado em colaboração entre everis, consultoria de negócios e TI do Grupo NTT Data, e a MIT Tech Review em espanhol aborda a adoção da agilidade nas principais empresas da América Latina. Acesse e saiba mais: https://lnkd.in/gbbDkyY #everisBrasil #everisNaMidia'",,,,12,0,0,"#everisBrasil, #everisNaMidia'",linkedin
405,everis,,2020-11-19,"“Temos profissionais diferenciados, que amam e acreditam verdadeiramente no que fazem. Que possuem um modelo de colaboração e cooperação totalmente distinto do mercado, estou convencido que o nosso maior diferencial como empresa, são os nossos profissionais.” De Miguel Filoso, Head of Digital Strategy & Technology everis Americas #everisenergy #everisdigitalconference #everisBrasil'",,,,21,1,0,"#everisenergy, #everisdigitalconference, #everisBrasil'",linkedin
406,everis,,2020-12-19,"Daqui a pouco, às 19h, teremos o webinar ""Qual é o papel dos testes na metodologia Ágil?"" Inscreva-se: https://lnkd.in/g-SK8Af#ITServices #everisBrasil #everis'",,,,10,0,0,"#ITServices, #everisBrasil, #everis'",linkedin
407,everis,,2020-11-19,"No encerramento da Internal Digital Conference, Juan Yañez falou da importância de focar no que realmente importa e que se sente privilegiado de trabalhar em uma companhia tão diferenciada, com atitude única. O momento é de agradecimento por todas as barreiras que ultrapassamos nos últimos anos.  #everisenergy #everisdigitalconference'",,,,33,0,0,"#everisenergy, #everisdigitalconference'",linkedin
408,everis,,2020-11-19,"Kazuhiro Gomi, Presidente & CEO na NTT Research fala em primeira mão sobre o projeto de criptografia avançada desenvolvida pela NTT Research, que tem como propósito proteger e disponibilizar informações e dados de maneira personalizada, priorizando a privacidade do usuário. #everisenergy #everisdigitalconference'",,,,6,0,0,"#everisenergy, #everisdigitalconference'",linkedin
409,everis,,2020-11-19,"Qual é o papel dos testes na metodologia Ágil? Este é o tema do nosso próximo #everisTalks Webinar, que ocorrerá na quarta-feira, 18 de novembro às 19h e será apresentado por Shirley Moura Silva e Francisco Laelson Rodrigues. Inscreva-se: https://lnkd.in/g-SK8Af#ITServices #everisBrasil #everis'",,,,54,0,0,"#everisTalks, #ITServices, #everisBrasil, #everis'",linkedin
410,everis,,2020-11-19,"A everis Internal Digital Conference começou com grande sucesso e no primeiro dia reuniu os CEOs da região das Américas, Juan Yáñez, o CEO da everis Global, Fritz Hordelein, e os CEOs de cada país da região das Américas: Pablo Pereira #everis Argentina, Juan Sebastian Escobar #everisColombia, Miguel Teixeira #everisChile, Mario Chao #everisMéxico, Javier Hoyle #everisPerú, Víctor Sierra #everisUSA, Ricardo Neves #everisBrasil. Os principais temas abordados foram os objetivos e desafios da everis e a visão de futuro de cada um deles. #everisenergy #everisdigitalconference'",,,,58,0,0,"#everis, #everisColombia,, #everisChile,, #everisMéxico,, #everisPerú,, #everisUSA,, #everisBrasil., #everisenergy, #everisdigitalconference'",linkedin
